{"ArtifactKind":"root-claims-occupancy","ClaimedLocationKey":"c:/fixture/shared-reasonix-root","ControlBase":"C:\\fixture\\local-a\\ai-agent-dotfiles\\control","DirectoryIdentity":"deadbeef:0123456789abcdef","EntryKey":"5c9d762222d0c7ef6b4f7557619e065a322ef67031216a44ff898fffc6cadf3c","HomeAuthorityKey":"aaaaaaaaaaaaaaaaaaaaaaaaaaaaaaaaaaaaaaaaaaaaaaaaaaaaaaaaaaaaaaaa","SchemaVersion":1,"VolumeId":"deadbeef"}